{
  "session_id": "sess_20260327_001",
  "site_id": "lab-a",
  "robot_id": "dual-arm-station-01",
  "status": "active",
  "title": "Dual-arm assembly supervision",
  "objective": "Track task progress, deviations, and teaching assets for a lab session.",
  "sop_plan_id": "sop_dual_arm_assembly_v1",
  "started_at": "2026-03-27T09:28:00Z",
  "ended_at": null,
  "created_at": "2026-03-27T09:27:50Z",
  "updated_at": "2026-03-27T09:28:00Z",
  "tags": [
    "assembly",
    "teaching-demo"
  ]
}
